{
  "abilities": [
    {
      "ability_id": "ability:Belveth:passive:ddragon-16.16.1",
      "damage_types": [
        "none"
      ],
      "detailed_description_zh": "每当卑尔维斯击杀大型小兵和野怪和英雄时，都会获得永久的额外攻速加成。她还会在使用一个技能后获得暂时的攻击速度加成。",
      "extraction": {
        "method": "deterministic_client_markup_v1",
        "notes": [
          "详细中文机制来自固定 CommunityDragon 客户端数据；数值占位符统一显示为【数值】。",
          "伤害类型和状态词只从客户端标记确定性提取，不由模型补写。"
        ],
        "status": "source_grounded"
      },
      "field_sources": {
        "detailed_description_zh": [
          "source:communitydragon:16.16:zh_cn:Belveth"
        ],
        "deterministic_hints": [
          "source:communitydragon:16.16:zh_cn:Belveth"
        ],
        "name_en": [
          "source:ddragon:16.16.1:en_US:Belveth"
        ],
        "name_zh": [
          "source:ddragon:16.16.1:zh_CN:Belveth"
        ],
        "summary_en": [
          "source:ddragon:16.16.1:en_US:Belveth"
        ],
        "summary_zh": [
          "source:ddragon:16.16.1:zh_CN:Belveth"
        ],
        "wiki_supplement": [
          "source:wiki:1525435:4050294"
        ]
      },
      "markup_tags": [],
      "mechanism_critical_numbers_preserved": true,
      "name_en": "Death in Lavender",
      "name_zh": "溶烛化紫",
      "slot": "passive",
      "source_ref_ids": [
        "source:ddragon:16.16.1:zh_CN:Belveth",
        "source:ddragon:16.16.1:en_US:Belveth",
        "source:communitydragon:16.16:zh_cn:Belveth",
        "source:wiki:1525435:4050294"
      ],
      "status_terms_zh": [],
      "summary_en": "Bel'Veth gains permanent attack speed stacks after taking down large minions and monsters and champions. She also gains temporary bonus attack speed after using an ability.",
      "summary_zh": "每当卑尔维斯击杀大型小兵和野怪和英雄时，都会获得永久的额外攻速加成。她还会在使用一个技能后获得暂时的攻击速度加成。",
      "wiki_source_ref_ids": [
        "source:wiki:1525435:4050294"
      ]
    },
    {
      "ability_id": "ability:Belveth:q:ddragon-16.16.1",
      "damage_types": [
        "physical"
      ],
      "detailed_description_zh": "卑尔维斯进行冲刺，对她途经的敌人们造成【数值】物理伤害。 每个方向都有为期【数值】秒的独立冷却时间 ，这些冷却时间随她的攻击速度的提升而缩短。",
      "extraction": {
        "method": "deterministic_client_markup_v1",
        "notes": [
          "详细中文机制来自固定 CommunityDragon 客户端数据；数值占位符统一显示为【数值】。",
          "伤害类型和状态词只从客户端标记确定性提取，不由模型补写。"
        ],
        "status": "source_grounded"
      },
      "field_sources": {
        "detailed_description_zh": [
          "source:communitydragon:16.16:zh_cn:Belveth"
        ],
        "deterministic_hints": [
          "source:communitydragon:16.16:zh_cn:Belveth"
        ],
        "name_en": [
          "source:ddragon:16.16.1:en_US:Belveth"
        ],
        "name_zh": [
          "source:ddragon:16.16.1:zh_CN:Belveth"
        ],
        "summary_en": [
          "source:ddragon:16.16.1:en_US:Belveth"
        ],
        "summary_zh": [
          "source:ddragon:16.16.1:zh_CN:Belveth"
        ],
        "wiki_supplement": [
          "source:wiki:1525436:4050295"
        ]
      },
      "markup_tags": [
        "physicaldamage",
        "br",
        "attackspeed"
      ],
      "mechanism_critical_numbers_preserved": false,
      "name_en": "Void Surge",
      "name_zh": "虚空激流",
      "slot": "q",
      "source_ref_ids": [
        "source:ddragon:16.16.1:zh_CN:Belveth",
        "source:ddragon:16.16.1:en_US:Belveth",
        "source:communitydragon:16.16:zh_cn:Belveth",
        "source:wiki:1525436:4050295"
      ],
      "status_terms_zh": [],
      "summary_en": "Bel'Veth dashes in a chosen direction and damages all enemies she passes through.",
      "summary_zh": "卑尔维斯朝选定方向进行突进，对途经的所有敌人造成伤害。",
      "wiki_source_ref_ids": [
        "source:wiki:1525436:4050295"
      ]
    },
    {
      "ability_id": "ability:Belveth:w:ddragon-16.16.1",
      "damage_types": [
        "magic"
      ],
      "detailed_description_zh": "卑尔维斯甩尾重击，对敌人们造成【数值】魔法伤害、【数值】秒击飞和持续【数值】秒的【数值】%减速。如果这个技能击中了一名敌方英雄，则刷新该英雄所在方向的虚空激流的冷却时间。",
      "extraction": {
        "method": "deterministic_client_markup_v1",
        "notes": [
          "详细中文机制来自固定 CommunityDragon 客户端数据；数值占位符统一显示为【数值】。",
          "伤害类型和状态词只从客户端标记确定性提取，不由模型补写。"
        ],
        "status": "source_grounded"
      },
      "field_sources": {
        "detailed_description_zh": [
          "source:communitydragon:16.16:zh_cn:Belveth"
        ],
        "deterministic_hints": [
          "source:communitydragon:16.16:zh_cn:Belveth"
        ],
        "name_en": [
          "source:ddragon:16.16.1:en_US:Belveth"
        ],
        "name_zh": [
          "source:ddragon:16.16.1:zh_CN:Belveth"
        ],
        "summary_en": [
          "source:ddragon:16.16.1:en_US:Belveth"
        ],
        "summary_zh": [
          "source:ddragon:16.16.1:zh_CN:Belveth"
        ],
        "wiki_supplement": [
          "source:wiki:1525437:4046855"
        ]
      },
      "markup_tags": [
        "magicdamage",
        "status",
        "spellname"
      ],
      "mechanism_critical_numbers_preserved": false,
      "name_en": "Above and Below",
      "name_zh": "上觐沉渊",
      "slot": "w",
      "source_ref_ids": [
        "source:ddragon:16.16.1:zh_CN:Belveth",
        "source:ddragon:16.16.1:en_US:Belveth",
        "source:communitydragon:16.16:zh_cn:Belveth",
        "source:wiki:1525437:4046855"
      ],
      "status_terms_zh": [
        "击飞",
        "减速"
      ],
      "summary_en": "Bel'Veth slams her tail to the ground, damaging, knocking up, and slowing her enemies.",
      "summary_zh": "卑尔维斯甩尾重击，对命中的敌人造成伤害、击飞和减速。",
      "wiki_source_ref_ids": [
        "source:wiki:1525437:4046855"
      ]
    },
    {
      "ability_id": "ability:Belveth:e:ddragon-16.16.1",
      "damage_types": [
        "physical"
      ],
      "detailed_description_zh": "卑尔维斯引导并斩击她自身的周围区域，获得【数值】%伤害减免、【数值】生命偷取、并在【数值】秒持续攻击【数值】次，攻击次数可通过攻击速度来提升。每次攻击都会打击生命值最低的敌人，基于目标的已损失生命值造成【数值】至【数值】物理伤害。 使用另一个技能或再次施放这个技能会使这个技能提前结束。",
      "extraction": {
        "method": "deterministic_client_markup_v1",
        "notes": [
          "详细中文机制来自固定 CommunityDragon 客户端数据；数值占位符统一显示为【数值】。",
          "伤害类型和状态词只从客户端标记确定性提取，不由模型补写。"
        ],
        "status": "source_grounded"
      },
      "field_sources": {
        "detailed_description_zh": [
          "source:communitydragon:16.16:zh_cn:Belveth"
        ],
        "deterministic_hints": [
          "source:communitydragon:16.16:zh_cn:Belveth"
        ],
        "name_en": [
          "source:ddragon:16.16.1:en_US:Belveth"
        ],
        "name_zh": [
          "source:ddragon:16.16.1:zh_CN:Belveth"
        ],
        "summary_en": [
          "source:ddragon:16.16.1:en_US:Belveth"
        ],
        "summary_zh": [
          "source:ddragon:16.16.1:zh_CN:Belveth"
        ],
        "wiki_supplement": [
          "source:wiki:1525438:4046605"
        ]
      },
      "markup_tags": [
        "attackspeed",
        "physicaldamage",
        "br",
        "recast"
      ],
      "mechanism_critical_numbers_preserved": false,
      "name_en": "Royal Maelstrom",
      "name_zh": "搠面皇锋",
      "slot": "e",
      "source_ref_ids": [
        "source:ddragon:16.16.1:zh_CN:Belveth",
        "source:ddragon:16.16.1:en_US:Belveth",
        "source:communitydragon:16.16:zh_cn:Belveth",
        "source:wiki:1525438:4046605"
      ],
      "status_terms_zh": [],
      "summary_en": "Bel'Veth roots herself in place, channeling a storm of slashes around her that targets the lowest-health enemy and grants her lifesteal and damage reduction.",
      "summary_zh": "卑尔维斯将她自身禁锢在原地，引导一阵切割风暴环绕自身，这个风暴会以生命值最低的敌人为目标并为她提供生命偷取和伤害减免。",
      "wiki_source_ref_ids": [
        "source:wiki:1525438:4046605"
      ]
    },
    {
      "ability_id": "ability:Belveth:r:ddragon-16.16.1",
      "damage_types": [
        "true"
      ],
      "detailed_description_zh": "被动：攻击造成额外的【数值】真实伤害，可无限叠加。参与击杀英雄和野怪之后会留下一块【虚空珊瑚】。 主动：卑尔维斯消耗一块【虚空珊瑚】，从而获得【数值】层溶烛化紫并激活她的真正形态。来自虚空史诗级野怪的【虚空珊瑚】会使附近阵亡的小兵们变为【虚空鱼】。在施放时，卑尔维斯减速附近的敌人们然后爆炸，造成【数值】 + 【数值】%已损失生命值的真实伤害。 在她的真实形态下，卑尔维斯获得【数值】最大生命值、【数值】移动距离、【数值】%总攻击速度、并且虚空激流可以穿过墙体。 真实形态持续【数值】秒，在【数值】层溶烛化紫时提升至【数值】秒。在【数值】层溶烛化紫时，真实伤害持续至阵亡为止。",
      "extraction": {
        "method": "deterministic_client_markup_v1",
        "notes": [
          "详细中文机制来自固定 CommunityDragon 客户端数据；数值占位符统一显示为【数值】。",
          "伤害类型和状态词只从客户端标记确定性提取，不由模型补写。"
        ],
        "status": "source_grounded"
      },
      "field_sources": {
        "detailed_description_zh": [
          "source:communitydragon:16.16:zh_cn:Belveth"
        ],
        "deterministic_hints": [
          "source:communitydragon:16.16:zh_cn:Belveth"
        ],
        "name_en": [
          "source:ddragon:16.16.1:en_US:Belveth"
        ],
        "name_zh": [
          "source:ddragon:16.16.1:zh_CN:Belveth"
        ],
        "summary_en": [
          "source:ddragon:16.16.1:en_US:Belveth"
        ],
        "summary_zh": [
          "source:ddragon:16.16.1:zh_CN:Belveth"
        ],
        "wiki_supplement": [
          "source:wiki:1525440:4051340"
        ]
      },
      "markup_tags": [
        "spellpassive",
        "truedamage",
        "br",
        "spellactive",
        "keywordmajor",
        "status",
        "healing",
        "attackspeed",
        "spellname",
        "rules"
      ],
      "mechanism_critical_numbers_preserved": false,
      "name_en": "Endless Banquet",
      "name_zh": "万载豪筵",
      "slot": "r",
      "source_ref_ids": [
        "source:ddragon:16.16.1:zh_CN:Belveth",
        "source:ddragon:16.16.1:en_US:Belveth",
        "source:communitydragon:16.16:zh_cn:Belveth",
        "source:wiki:1525440:4051340"
      ],
      "status_terms_zh": [
        "减速"
      ],
      "summary_en": "Bel'Veth consumes Void coral remnants, transforming into her true form and increasing her max health, attack range, and attack speed. Consuming the Void coral remnants of a Void epic monster will grant her the power to summon Void remora.",